ID,AU,TI,SO,KW,AB,AF,TC,DI,PY
1836,"Nyberg, Johan; Malmgren, Bjorn A.; Winter, Amos; Jury, Mark R.; Kilbourne, K. Halimeda; Quinn, Terrence M.",Low Atlantic hurricane activity in the 1970s and 1980s compared to the past 270 years,NATURE,TROPICAL ATLANTIC; MAUNDER MINIMUM; CORAL SKELETONS; INTENSITY; FREQUENCY; SEA; LUMINESCENCE; VARIABILITY; CENTURIES; RAINFALL,"Hurricane activity in the North Atlantic Ocean has increased significantly since 1995 ( refs 1,2). This trend has been attributed to both anthropogenically induced climate change(3) and natural variability(1), but the primary cause remains uncertain. Changes in the frequency and intensity of hurricanes in the past can provide insights into the factors that influence hurricane activity, but reliable observations of hurricane activity in the North Atlantic only cover the past few decades(2). Here we construct a record of the frequency of major Atlantic hurricanes over the past 270 years using proxy records of vertical wind shear and sea surface temperature ( the main controls on the formation of major hurricanes kin this region(1,3-5)) from corals and a marine sediment core. The record indicates that the average frequency of major hurricanes decreased gradually from the 1760s until the early 1990s, reaching anomalously low values during the 1970s and 1980s. Furthermore, the phase of enhanced hurricane activity since 1995 is not unusual compared to other periods of high hurricane activity in the record and thus appears to represent a recovery to normal hurricane activity, rather than a direct response to increasing sea surface temperature. Comparison of the record with a reconstruction of vertical wind shear indicates that variability in this parameter primarily controlled the frequency of major hurricanes in the Atlantic over the past 270 years, suggesting that changes in the magnitude of vertical wind shear will have a significant influence on future hurricane activity.","Geol Survey Sweden, SE-75128 Uppsala, Sweden; Univ Gothenburg, Dept Earth Sci, SE-40530 Gothenburg, Sweden; Univ Puerto Rico, Dept Phys, Mayaguez, PR 00681 USA; Univ S Florida, Coll Marine Sci, St Petersburg, FL 33707 USA; NOAA, Earth Syst Res Lab, Phys Sci Div R PSD1, Boulder, CO 80305 USA; Univ Texas, Dept Geol Sci, Jackson Sch Geosci, Austin, TX 78712 USA; Univ Texas, Inst Geophys, Austin, TX 78758 USA",91,10.1038/nature05895,2007
1837,"Stone, Richard",A world without corals?,SCIENCE,,,,12,10.1126/science.316.5825.678,2007
1838,"Pala, Christopher",Palau combats coral bleaching,SCIENCE,,,,0,10.1126/science.316.5825.680,2007
1839,"Almany, Glenn R.; Berumen, Michael L.; Thorrold, Simon R.; Planes, Serge; Jones, Geoffrey P.",Local replenishment of coral reef fish populations in a marine reserve,SCIENCE,DISPERSAL DISTANCE; SELF-RECRUITMENT; LARVAE; CONNECTIVITY; RETENTION; DESIGN; CONSEQUENCES; MECHANISMS; HOME,"The scale of larval dispersal of marine organisms is important for the design of networks of marine protected areas. We examined the fate of coral reef fish larvae produced at a small island reserve, using a mass-marking method based on maternal transmission of stable isotopes to offspring. Approximately 60% of settled juveniles were spawned at the island, for species with both short (< 2 weeks) and long (> 1 month) pelagic larval durations. If natal homing of larvae is a common life-history strategy, the appropriate spatial scales for the management and conservation of coral reefs are likely to be much smaller than previously assumed.","James Cook Univ N Queensland, Australian Res Council Ctr Excellence Coral Reef, Townsville, Qld 4811, Australia; James Cook Univ N Queensland, Sch Marine & Trop Biol, Townsville, Qld 4811, Australia; Univ Arkansas, Dept Biol Sci, Fayetteville, AR 72701 USA; Woods Hole Oceanog Inst, Dept Biol, Woods Hole, MA 02543 USA; Ecole Prat Hautes Etud, CNRS, Joint Res Unit 5244, Ctr Biol & Ecol Trop & Mediterraneene, F-66850 Perpignan, France",389,10.1126/science.1140597,2007
1840,"Pauly, Daniel",Coral: A pessimist in paradise,NATURE,,,"Univ British Columbia, Fisheries Ctr, Vancouver, BC V6T 1Z4, Canada",2,10.1038/447033a,2007
1841,"Fine, Maoz; Tchernov, Dan",Scleractinian coral species survive and recover from decalcification,SCIENCE,EVOLUTION; CARBON,,"Bar Ilan Univ, Fac Life Sci, IL-52900 Ramat Gan, Israel; Hebrew Univ Jerusalem, Dept Evolut Systemat & Ecol, IL-91904 Jerusalem, Israel; Interuniv Inst Marine Sci, IL-88103 Elat, Israel",167,10.1126/science.1137094,2007
1842,"Abram, Nerilie J.; Gagan, Michael K.; Liu, Zhengyu; Hantoro, Wahyoe S.; McCulloch, Malcolm T.; Suwargadi, Bambang W.",Seasonal characteristics of the Indian Ocean Dipole during the Holocene epoch,NATURE,SEA-SURFACE TEMPERATURE; SUMMER MONSOON; EL-NINO; ASIAN MONSOON; ENSO; PACIFIC; PRECIPITATION; OSCILLATION; MIDHOLOCENE; VARIABILITY,"The Indian Ocean Dipole(1,2) (IOD) - an oscillatory mode of coupled ocean - atmosphere variability - causes climatic extremes and socio-economic hardship throughout the tropical Indian Ocean region(1-5). There is much debate about how the IOD interacts with the El Nino/Southern Oscillation (ENSO) and the Asian monsoon, and recent changes in the historic ENSO - monsoon relationship(6) raise the possibility that the properties of the IOD may also be evolving. Improving our understanding of IOD events and their climatic impacts thus requires the development of records defining IOD activity in different climatic settings, including prehistoric times when ENSO and the Asian monsoon behaved differently from the present day. Here we use coral geochemical records from the equatorial eastern Indian Ocean to reconstruct surface-ocean cooling and drought during individual IOD events over the past similar to 6,500 years. We find that IOD events during the middle Holocene were characterized by a longer duration of strong surface ocean cooling, together with droughts that peaked later than those expected by El Nino forcing alone. Climate model simulations suggest that this enhanced cooling and drying was the result of strong cross-equatorial winds driven by the strengthened Asian monsoon of the middle Holocene. These IOD - monsoon connections imply that the socioeconomic impacts of projected future changes in Asian monsoon strength may extend throughout Australasia.","Australian Natl Univ, Res Sch Earth Sci, Canberra, ACT 0200, Australia; Univ Wisconsin, Ctr Climat Res, Madison, WI 53706 USA; Chinese Acad Sci, Earth Environm Inst, Xian 710075, Peoples R China; Ocean Univ China, Qingdao 266003, Peoples R China; Indonesian Inst Sci, Res & Dev Ctr Geotechnol, Bandung 40135, Indonesia",98,10.1038/nature05477,2007
1843,"Madin, Joshua S.; Connolly, Sean R.",Ecological consequences of major hydrodynamic disturbances on coral reefs,NATURE,RESILIENCE; ECOSYSTEMS; TSUNAMI,"A recent tsunami(1,2) and an apparent increase in the frequency of severe tropical storms(3-5) underscore the need to understand and predict the ecological consequences of major hydrodynamic disturbances(6). Reef corals provide the habitat structure that sustains the high biodiversity of tropical reefs(7), and thus provide the foundation for the ecosystem goods and services that are critical to many tropical societies(6,8). Here we integrate predictions from oceanographic models(9) with engineering theory, to predict the dislodgement of benthic reef corals during hydrodynamic disturbances. This generalizes earlier work(10,11), by incorporating colonies of any shape and by explicitly examining the effects of hydrodynamic gradients on coral assemblage structure. Afield test shows that this model accurately predicts changes in the mechanical vulnerability of coral colonies, and thus their size and shape, with distance from the reef crest. This work provides a general framework for understanding and predicting the effects of hydrodynamic disturbances on coral reef communities; such disturbances have a major role in determining species zonation(12,13) and coexistence(14) on coral reefs, and are critical determinants of how coral assemblages will respond to changes in the frequency and intensity of tropical storms associated with a changing climate(3-5,15).","James Cook Univ N Queensland, Sch Marine & Trop Biol, Townsville, Qld 4811, Australia; James Cook Univ N Queensland, ARC Ctr Excellence Coral Reef Studies, Townsville, Qld 4811, Australia; Univ Calif Santa Barbara, Natl Ctr Ecol Anal & Synth, Santa Barbara, CA 93101 USA",158,10.1038/nature05328,2006
1844,"Jameson, Stephen C.",How protected are coral reefs?,SCIENCE,,,"Coral Seas Inc, Integrated Costal Zone Management, The Plains, VA 20198 USA",1,,2006
1845,"Ricciardi, Anthony",How protected are coral reefs?,SCIENCE,,,"McGill Univ, Redpath Museum, Montreal, PQ H3A 2K6, Canada",2,,2006
1846,"McManus, Ed; Besancon, Charles; Johnson, Tim",How protected are coral reefs?,SCIENCE,,,"United Nations Environm Programme, World Conservat Monitoring Ctr, Cambridge CB3 0DL, England",0,,2006
1847,"Mora, Camilo; Andrefouet, Serge; Costello, Mark J.; Kranenburg, Christine; Rollo, Audrey; Veron, John; Gaston, Kevin J.; Myers, Ransom A.",How protected are coral reefs? Response,SCIENCE,,,"Dalhousie Univ, Dept Biol, Halifax, NS B3H 4J1, Canada; Univ Auckland, Leigh Marine Lab, Warkworth, New Zealand; Inst Rech Dev, Noumea, New Caledonia; Univ S Florida, Inst Marine Remote Sensing, St Petersburg, FL 33701 USA; Australian Inst Marine Sci, Townsville, Qld 4810, Australia; Univ Sheffield, Dept Anim & Plant Sci, Biodivers & Macroecol Grp, Sheffield S10 2TN, S Yorkshire, England",2,,2006
1848,"Spalding, Mark; Kelleher, Graeme; Boucher, Timothy; Fish, Lucy",How protected are coral reefs?,SCIENCE,,,"Nature Conservancy, Global Conservat Approach Team, Arlington, VA 22203 USA; World Commiss Protected Areas High Seas MPA Task, Canberra, ACT 2614, Australia; UNEP, WCMC, Cambridge CB3 0DL, England",2,,2006
1849,"Matear, Richard J.; McNeil, Ben I.","Comment on ""Preindustrial to modern interdecadal variability in coral reef pH""",SCIENCE,GREAT-BARRIER-REEF; CARBON BUDGET; CO2,,"Commonwealth Sci & Ind Res Org Marine & Atmospher, Hobart, Tas, Australia; Antarctic Climate & Ecosyst Cooperat Res Ctr, Hobart, Tas, Australia; Univ New S Wales, Sch Math, Climate & Environm Dynam Lab, Sydney, NSW, Australia",7,10.1126/science.1128198,2006
1850,"Pelejero, Carles; Calvo, Eva; McCulloch, Malcolm T.; Marshall, John F.; Gagan, Michael K.; Lough, Janice M.; Opdyke, Bradley N.","Response to comment on ""Preindustrial to modern interdecadal variability in coral reef pH""",SCIENCE,COMMUNITY METABOLISM; SKELETAL DELTA-C-13; CARBON; FLUXES; LIGHT,,"ICREA, Inst Catalan Recerca & Estudis Avancats, Barcelona 08003, Catalonia, Spain; CSIC, ICM, Inst Ciencias Mar, Barcelona 08003, Catalonia, Spain; CSIC, CMIMA, Inst Ciencias Mar, Barcelona 08003, Catalonia, Spain; Australian Natl Univ, Res Sch Earth Sci, Canberra, ACT 0200, Australia; Geosci Australia, Petr & Marine Div, Canberra, ACT 2601, Australia; Australian Inst Marine Sci, Townsville, Qld 4810, Australia; Australian Natl Univ, Dept Earth & Marine Sci, Canberra, ACT 0200, Australia",4,10.1126/science.1128502,2006
1851,"Dornelas, Maria; Connolly, Sean R.; Hughes, Terence P.","Coral reef diversity refutes the neutral theory of biodiversity (vol 440, pg 80, 2006)",NATURE,,,,3,10.1038/nature05187,2006
1852,"Dawson, MN; Grosberg, RK; Botsford, LW",Connectivity in marine protected areas,SCIENCE,CORAL-REEF FISH; RESERVES; FISHERIES; SUSTAINABILITY; POPULATIONS; EVOLUTION,,"Univ Calif Davis, Coll Biol Sci, Sect Evolut & Ecol, Davis, CA 95616 USA; Univ Calif Davis, Dept Wildlife Fish & Conservat Biol, Davis, CA 95616 USA",19,,2006
1853,"Mora, C; Andrefouet, S; Costello, MJ; Kranenburg, C; Rollo, A; Veron, J; Gaston, KJ; Myers, RA",Coral reefs and the global network of marine protected areas,SCIENCE,POPULATIONS; RESERVES,,"Univ Auckland, Leigh Marine Lab, Warkworth, New Zealand; Dalhousie Univ, Dept Biol Sci, Halifax, NS B4H 4J1, Canada; Inst Rech Dev, Noumea, New Caledonia; Univ S Florida, Inst Marine Remote Sensing, St Petersburg, FL 33701 USA; Australian Inst Marine Sci, Townsville, Qld 4810, Australia; Univ Sheffield, Biodivers & Macroecol Grp, Dept Anim & Plant Sci, Sheffield S10 2TN, S Yorkshire, England",276,10.1126/science.1125295,2006
1854,"Montagna, P; McCulloch, M; Taviani, M; Mazzoli, C; Vendrell, B",Phosphorus in cold-water corals as a proxy for seawater nutrient chemistry,SCIENCE,MARINE-SEDIMENTS; SEA; ACCUMULATION; SKELETONS; CARBONATE; PRIMNOA,Phosphorus is a key macronutrient being strongly enriched in the deep ocean as a result of continuous export and remineralization of biomass from primary production. We show that phosphorus incorporated within the skeletons of the cosmopolitan cold-water coral Desmophyllum dianthus is directly proportional to the ambient seawater phosphorus concentration and thus may serve as a paleo-oceanographic proxy for variations in ocean productivity as well as changes in the residence times and sources of deep-water masses. The application of this tool to fossil specimens from the Mediterranean reveals phosphorus-enriched bottom waters at the end of the Younger Dryas period.,"ICRAM, I-00166 Rome, Italy; Australian Natl Univ, Res Sch Earth Sci, Canberra, ACT 0200, Australia; CNR, Ist Sci Marine, I-40129 Bologna, Italy; Univ Padua, Dipartimento Mineral & Petrol, I-35137 Padua, Italy; CNR, Ist Geosci & Georisorse, I-35137 Padua, Italy; CSIC, Inst Ciencias Mar, E-08003 Barcelona, Spain",64,10.1126/science.1125781,2006
1855,"Lovis, C; Mayor, M; Pepe, F; Alibert, Y; Benz, W; Bouchy, F; Correia, ACM; Laskar, J; Mordasini, C; Queloz, D; Santos, NC; Udry, S; Bertaux, JL; Sivan, JP",An extrasolar planetary system with three Neptune-mass planets,NATURE,MAIN-SEQUENCE STARS; SOLAR PLANETS; HARPS SEARCH; CORALIE SURVEY; MU-ARAE; JUPITER; MODELS; MIGRATION,"Over the past two years, the search for low-mass extrasolar planets has led to the detection of seven so-called 'hot Neptunes' or 'super-Earths' around Sun-like stars. These planets have masses 5 - 20 times larger than the Earth and are mainly found on close-in orbits with periods of 2 - 15 days. Here we report a system of three Neptune-mass planets with periods of 8.67, 31.6 and 197 days, orbiting the nearby star HD 69830. This star was already known to show an infrared excess possibly caused by an asteroid belt within 1 AU ( the Sun - Earth distance). Simulations show that the system is in a dynamically stable configuration. Theoretical calculations favour a mainly rocky composition for both inner planets, while the outer planet probably has a significant gaseous envelope surrounding its rocky/icy core; the outer planet orbits within the habitable zone of this star.","Observ Geneva, CH-1290 Sauverny, Switzerland; Univ Bern, Inst Phys, CH-3012 Bern, Switzerland; Observ Haute Provence, F-04870 St Michel lObservatoire, France; Inst Astrophys, F-75014 Paris, France; Univ Aveiro, Dept Fis, P-3810193 Aveiro, Portugal; IMCCE, CNRS, UMR 8028, F-75014 Paris, France; Univ Lisbon, Ctr Astron & Astrofis, Observ Astron Lisboa, P-1349018 Lisbon, Portugal; Colegio Luis Verney, Ctr Geofis Evora, P-7002554 Evora, Portugal; CNRS, Serv Aeron, F-91371 Verrieres Le Buisson, France; Lab Astrophys Marseille, F-13013 Marseille, France",273,10.1038/nature04828,2006
1856,"Stanley, GD",Ecology - Photosymbiosis and the evolution of modern coral reefs,SCIENCE,,,"Univ Montana, Paleontol Ctr, Missoula, MT 59812 USA",70,10.1126/science.1123701,2006
1857,"Roberts, JM; Wheeler, AJ; Freiwald, A",Reefs of the deep: The biology and geology of cold-water coral ecosystems,SCIENCE,NORTHEAST ATLANTIC; LOPHELIA-PERTUSA; SEA CORALS; ROCKALL TROUGH; NE ATLANTIC; MOUNDS; OCEAN; SCLERACTINIA; VENTILATION; IMPACTS,"Coral reefs are generally associated with shallow tropical seas; however, recent deep-ocean exploration using advanced acoustics and submersibles has revealed unexpectedly widespread and diverse coral ecosystems in deep waters on continental shelves, slopes, seamounts, and ridge systems around the world. Advances reviewed here include the use of corals as paleoclimatic archives and their biogeological functioning, biodiversity, and biogeography. Threats to these fragile, long-lived, and rich ecosystems are mounting: The impacts of deep-water trawling are already widespread, and effects of ocean acidification are potentially devastating.","Scottish Assoc Marine Sci, Dunstaffnage Marine Lab, Oban PA37 1QA, Argyll, Scotland; Natl Univ Ireland Univ Coll Cork, Dept Geol, Cork, Ireland; Natl Univ Ireland Univ Coll Cork, Environm Res Inst, Cork, Ireland; Erlangen Univ, Inst Paleontol, D-91054 Erlangen, Germany",484,10.1126/science.1119861,2006
1858,"Grottoli, AG; Rodrigues, LJ; Palardy, JE",Heterotrophic plasticity and resilience in bleached corals,NATURE,REEF CORALS; TISSUE BIOMASS; CLIMATE-CHANGE; MORTALITY; ZOOPLANKTON; HAWAIIAN; PATTERNS; PACIFIC; CARBON; EVENT,"Mass coral bleaching events caused by elevated seawater temperatures(1,2) have resulted in extensive coral mortality throughout the tropics over the past few decades(3,4). With continued global warming, bleaching events are predicted to increase in frequency and severity, causing up to 60% coral mortality globally within the next few decades(4-6). Although some corals are able to recover and to survive bleaching(7,8), the mechanisms underlying such resilience are poorly understood. Here we show that the coral host has a significant role in recovery and resilience. Bleached and recovering Montipora capitata (branching) corals met more than 100% of their daily metabolic energy requirements by markedly increasing their feeding rates and CHAR (per cent contribution of heterotrophically acquired carbon to daily animal respiration), whereas Porites compressa (branching) and Porites lobata (mounding) corals did not. These findings suggest that coral species with high-CHAR capability during bleaching and recovery, irrespective of morphology, will be more resilient to bleaching events over the long term, could become the dominant coral species on reefs, and may help to safeguard affected reefs from potential local and global extinction.","Ohio State Univ, Dept Geol Sci, Columbus, OH 43210 USA; Villanova Univ, Dept Biol, Villanova, PA 19085 USA; Brown Univ, Dept Ecol & Evolutionary Biol, Providence, RI 02912 USA",342,10.1038/nature04565,2006
1859,"Briggs, RW; Sieh, K; Meltzner, AJ; Natawidjaja, D; Galetzka, J; Suwargadi, B; Hsu, YJ; Simons, M; Hananto, N; Suprihanto, I; Prayudi, D; Avouac, JP; Prawirodirdjo, L; Bock, Y",Deformation and slip along the Sunda Megathrust in the great 2005 Nias-Simeulue earthquake,SCIENCE,SUMATRAN SUBDUCTION ZONE; CRUSTAL DEFORMATION; BOUNDARY; MODEL; MICROATOLLS; MECHANISM; INDONESIA; HISTORY; JAPAN; ARC,"Seismic rupture produced spectacular tectonic deformation above a 400-kilometer strip of the Sunda megathrust, offshore northern Sumatra, in March 2005. Measurements from coral microatolls and Global Positioning System stations reveal trench-parallel belts of uplift up to 3 meters high on the outer-arc islands above the rupture and a 1-meter-deep subsidence trough farther from the trench. Surface deformation reflects more than 11 meters of fault slip under the islands and a pronounced lessening of slip trenchward. A saddle in megathrust slip separates the northwestern edge of the 2005 rupture from the great 2004 Sumatra-Andaman rupture. The southeastern edge abuts a predominantly aseismic section of the megathrust near the equator.","CALTECH, Div Geol & Planetary Sci, Tecton Observ, Pasadena, CA 91125 USA; Indonesian Inst Sci, Res Ctr Geotechnol, Bandung, Indonesia; Jl Mahoni, Kota Jakarta 14270, Indonesia; Univ Calif San Diego, Scripps Inst Oceanog, Cecil H & Ida M Green Inst Geophys & Planetary Ph, La Jolla, CA 92093 USA",205,10.1126/science.1122602,2006
1860,"Overpeck, JT; Otto-Bliesner, BL; Miller, GH; Muhs, DR; Alley, RB; Kiehl, JT",Paleoclimatic evidence for future ice-sheet instability and rapid sea-level rise,SCIENCE,LAST INTERGLACIAL PERIOD; ANTARCTIC PENINSULA; GLACIAL CYCLES; CLIMATE; 21ST-CENTURY; DURATION; CORALS; RECORD; GROWTH; AGES,"Sea-level rise from melting of polar ice sheets is one of the largest potential threats of future climate change. Polar warming by the year 2100 may reach levels similar to those of 130,000 to 127,000 years ago that were associated with sea levels several meters above modern levels; both the Greenland Ice Sheet and portions of the Antarctic Ice Sheet may be vulnerable. The record of past ice-sheet melting indicates that the rate of future melting and related sea-level rise could be faster than widely thought.","Univ Arizona, Dept Geosci, Inst Study Planet Earth, Tucson, AZ 85721 USA; Univ Arizona, Dept Atmospher Sci, Tucson, AZ 85721 USA; Natl Ctr Atmospher Res, Boulder, CO 80307 USA; Univ Colorado, Inst Arctic & Alpine Res, Boulder, CO 80309 USA; Univ Colorado, Dept Geol Sci, Boulder, CO 80309 USA; US Geol Survey, Lakewood, CO 80225 USA; Penn State Univ, Dept Geosci, University Pk, PA 16802 USA; Penn State Univ, Penn State Ice & Climate Explorat Ctr, University Pk, PA 16802 USA",281,10.1126/science.1115159,2006
1861,"Pandolfi, JM",Ecology - Corals fail a test of neutrality,NATURE,COMMUNITIES,,"Univ Queensland, Dept Earth Sci, Brisbane, Qld 4072, Australia; Univ Queensland, Ctr Marine Studies, Brisbane, Qld 4072, Australia",4,10.1038/440035a,2006
1862,"Subarya, C; Chlieh, M; Prawirodirdjo, L; Avouac, JP; Bock, Y; Sieh, K; Meltzner, AJ; Natawidjaja, DH; McCaffrey, R",Plate-boundary deformation associated with the great Sumatra-Andaman earthquake,NATURE,GPS MEASUREMENTS; SUBDUCTION ZONE; CORAL MICROATOLLS; CRUSTAL MOTION; SEISMICITY; FAULT; ARC; CONSTRAINTS; INDONESIA; HISTORY,"The Sumatra - Andaman earthquake of 26 December 2004 is the first giant earthquake ( moment magnitude M-w. 9.0) to have occurred since the advent of modern space-based geodesy and broadband seismology. It therefore provides an unprecedented opportunity to investigate the characteristics of one of these enormous and rare events. Here we report estimates of the ground displacement associated with this event, using near-field Global Positioning System ( GPS) surveys in northwestern Sumatra combined with in situ and remote observations of the vertical motion of coral reefs. These data show that the earthquake was generated by rupture of the Sunda subduction megathrust over a distance of >1,500 kilometres and a width of,150 kilometres. Megathrust slip exceeded 20 metres offshore northern Sumatra, mostly at depths shallower than 30 kilometres. Comparison of the geodetically and seismically inferred slip distribution indicates that,30 per cent additional fault slip accrued in the 1.5 months following the 500-second-long seismic rupture. Both seismic and aseismic slip before our re-occupation of GPS sites occurred on the shallow portion of the megathrust, where the large Aceh tsunami originated. Slip tapers off abruptly along strike beneath Simeulue Island at the southeastern edge of the rupture, where the earthquake nucleated and where an M-w = 7.2 earthquake occurred in late 2002. This edge also abuts the northern limit of slip in the 28 March 2005 M-w = 8.7 Nias - Simeulue earthquake.","CALTECH, Div Geol & Planetary Sci, Tecton Observ, Pasadena, CA 91125 USA; Natl Coordinating Agcy Surveys & Mapping, Cibinong 16911, Indonesia; Univ Calif San Diego, Scripps Inst Oceanog, Cecil H & Ida M Green Inst Geophys & Planetary Ph, La Jolla, CA 92093 USA; Indonesian Inst Sci, Res Ctr Geotechnol, Bandung 40135, Indonesia; Rensselaer Polytech Inst, Dept Earth & Environm Sci, Troy, NY 12180 USA",268,10.1038/nature04522,2006
1863,"Dornelas, M; Connolly, SR; Hughes, TP",Coral reef diversity refutes the neutral theory of biodiversity,NATURE,SPECIES-ABUNDANCE DISTRIBUTION; FOREST BIODIVERSITY; LONG-TERM; COMMUNITIES; ECOLOGY; HYPOTHESIS; STABILITY; MODEL,"The global decline of coral reefs(1,2) highlights the need to understand the mechanisms that regulate community structure and sustain biodiversity in these systems. The neutral theory, which assumes that individuals are demographically identical regardless of species, seeks to explain ubiquitous features of community structure and biodiversity patterns(3-5). Here we present a test of neutral-theory predictions with the use of an extensive species-level data set of Indo-Pacific coral communities. We show that coral assemblages differ markedly from neutral-model predictions for patterns of community similarity and the relative abundance of species. Within local communities, neutral models do not fit relative abundance distributions as well as the classical log-normal distribution. Relative abundances of species across local communities also differ markedly from neutral-theory predictions: coral communities exhibit community similarity values that are far more variable, and lower on average, than the neutral theory can produce. Empirical community similarities deviate from the neutral model in a direction opposite to that predicted in previous critiques of the neutral theory(6-9). Instead, our results support spatio-temporal environmental stochasticity as a major driver of diversity patterns on coral reefs(10,11).","James Cook Univ N Queensland, ARC Ctr Excellence Coral Reef Studies, Townsville, Qld 4811, Australia; James Cook Univ N Queensland, Sch Marine Biol & Aquaculture, Townsville, Qld 4811, Australia",156,10.1038/nature04534,2006
1864,"Kintisch, E",AAAS Annual Meeting - Don't sugarcoat corals,SCIENCE,,,,1,,2006
